"","title","author","subject","abstract","date"
"99","understanding biology in the age of artificial intelligence","elsa lawrence, adham el-shazly, srijit seal, chaitanya k joshi, pietro liò, shantanu singh, andreas bender, pietro sormanni, matthew greenig","artificial intelligence","modern life sciences research is increasingly relying on artificial intelligence approaches to model biological systems, primarily centered around the use of machine learning (ml) models. although ml is undeniably useful for identifying patterns in large, complex data sets, its widespread application in biological sciences represents a significant deviation from traditional methods of scientific inquiry. as such, the interplay between these models and scientific understanding in biology is a topic with important implications for the future of scientific research, yet it is a subject that has received little attention. here, we draw from an epistemological toolkit to contextualize recent applications of ml in biological sciences under modern philosophical theories of understanding, identifying general principles that can guide the design and application of ml systems to model biological phenomena and advance scientific knowledge. we propose that conceptions of scientific understanding as information compression, qualitative intelligibility, and dependency relation modelling provide a useful framework for interpreting ml-mediated understanding of biological systems. through a detailed analysis of two key application areas of ml in modern biological research - protein structure prediction and single cell rna-sequencing - we explore how these features have thus far enabled ml systems to advance scientific understanding of their target phenomena, how they may guide the development of future ml models, and the key obstacles that remain in preventing ml from achieving its potential as a tool for biological discovery. consideration of the epistemological features of ml applications in biology will improve the prospects of these methods to solve important problems and advance scientific understanding of living systems.",2024-03-06
"100","semi-supervised dialogue abstractive summarization via high-quality pseudolabel selection","jianfeng he, hang su, jason cai, igor shalyminov, hwanjun song, saab mansour","computation and language","semi-supervised dialogue summarization (ssds) leverages model-generated summaries to reduce reliance on human-labeled data and improve the performance of summarization models. while addressing label noise, previous works on semi-supervised learning primarily focus on natural language understanding tasks, assuming each sample has a unique label. however, these methods are not directly applicable to ssds, as it is a generative task, and each dialogue can be summarized in different ways. in this work, we propose a novel scoring approach, sicf, which encapsulates three primary dimensions of summarization model quality: semantic invariance (indicative of model confidence), coverage (factual recall), and faithfulness (factual precision). using the sicf score, we select unlabeled dialogues with high-quality generated summaries to train summarization models. comprehensive experiments on three public datasets demonstrate the effectiveness of sicf scores in uncertainty estimation and semi-supervised learning for dialogue summarization tasks. our code is available at \url{this https url}.",2024-03-06
"101","a sierpinski triangle data structure for efficient array value update and prefix sum calculation","brent harrison, jason necaise, andrew projansky, james d. whitfield","data structures and algorithms","the binary indexed tree, or fenwick tree, is a data structure that can efficiently update values and calculate prefix sums in an array. it allows both of these operations to be performed in $o(\log_2 n)$ time. here we present a novel data structure resembling the sierpinski triangle, which accomplishes these operations with the same memory usage in $o(\log_3 n)$ time instead. we show this order to be optimal by making use of a connection to quantum computing.",2024-03-06
"102","on outer bi-lipschitz extensions of linear johnson-lindenstrauss embeddings of subsets of $\mathbb{r}^n$","rafael chiclana, mark a. iwen, mark philip roach","metric geometry","the celebrated johnson-lindenstrauss lemma states that for all $\varepsilon \in (0,1)$ and finite sets $x \subseteq \mathbb{r}^n$ with $n>1$ elements, there exists a matrix $\phi \in \mathbb{r}^{m \times n}$ with $m=\mathcal{o}(\varepsilon^{-2}\log n)$ such that \[ (1 - \varepsilon) \|x-y\|_2 \leq \|\phi x-\phi y\|_2 \leq (1+\varepsilon)\| x- y\|_2 \quad \forall\, x, y \in x.\] herein we consider terminal embedding results which have recently been introduced in the computer science literature as stronger extensions of the johnson-lindenstrauss lemma for finite sets. after a short survey of this relatively recent line of work, we extend the theory of terminal embeddings to hold for arbitrary (e.g., infinite) subsets $x \subseteq \mathbb{r}^n$, and then specialize our generalized results to the case where $x$ is a low-dimensional compact submanifold of $\mathbb{r}^n$. in particular, we prove the following generalization of the johnson-lindenstrauss lemma: for all $\varepsilon \in (0,1)$ and $x\subseteq\mathbb{r}^n$, there exists a terminal embedding $f: \mathbb{r}^n \longrightarrow \mathbb{r}^{m}$ such that $$(1 - \varepsilon) \| x - y \|_2 \leq \left\| f(x) - f(y) \right\|_2 \leq (1 + \varepsilon) \| x - y \|_2 \quad \forall \, x \in x ~{\rm and}~ \forall \, y \in \mathbb{r}^n.$$ crucially, we show that the dimension $m$ of the range of $f$ above is optimal up to multiplicative constants, satisfying $m=\mathcal{o}(\varepsilon^{-2} \omega^2(s_x))$, where $\omega(s_x)$ is the gaussian width of the set of unit secants of $x$, $s_x=\overline{\{(x-y)/\|x-y\|_2 \colon x \neq y \in x\}}$. furthermore, our proofs are constructive and yield algorithms for computing a general class of terminal embeddings $f$, an instance of which is demonstrated herein to allow for more accurate compressive nearest neighbor classification than standard linear johnson-lindenstrauss embeddings do in practice.",2024-03-06
"103","on htlc-based protocols for multi-party cross-chain swaps","emily clark, chloe georgiou, katelyn poon, marek chrobak","data structures and algorithms","in his 2018 paper, herlihy introduced an atomic protocol for multi-party asset swaps across different blockchains. his model represents an asset swap by a directed graph whose nodes are the participating parties and edges represent asset transfers, and rational behavior of the participants is captured by a preference relation between a protocol's outcomes. asset transfers between parties are achieved using smart contracts. these smart contracts are quite involved and they require storage and processing of a large number of paths in the swap digraph, limiting practical significance of his protocol. his paper also describes a different protocol that uses only standard hash time-lock contracts (htlc's), but this simpler protocol applies only to some special types of digraphs. he left open the question whether there is a simple and efficient protocol for cross-chain asset swaps in arbitrary digraphs. motivated by this open problem, we conducted a comprehensive study of \emph{htlc-based protocols}, in which all asset transfers are implemented with htlcs. our main contribution is a full characterization of swap digraphs that have such protocols.",2024-03-06
"104","black-box $k$-to-$1$-pca reductions: theory and applications","arun jambulapati, syamantak kumar, jerry li, shourya pandey, ankit pensia, kevin tian","numerical analysis","the $k$-principal component analysis ($k$-pca) problem is a fundamental algorithmic primitive that is widely-used in data analysis and dimensionality reduction applications. in statistical settings, the goal of $k$-pca is to identify a top eigenspace of the covariance matrix of a distribution, which we only have implicit access to via samples. motivated by these implicit settings, we analyze black-box deflation methods as a framework for designing $k$-pca algorithms, where we model access to the unknown target matrix via a black-box $1$-pca oracle which returns an approximate top eigenvector, under two popular notions of approximation. despite being arguably the most natural reduction-based approach to $k$-pca algorithm design, such black-box methods, which recursively call a $1$-pca oracle $k$ times, were previously poorly-understood. our main contribution is significantly sharper bounds on the approximation parameter degradation of deflation methods for $k$-pca. for a quadratic form notion of approximation we term epca (energy pca), we show deflation methods suffer no parameter loss. for an alternative well-studied approximation notion we term cpca (correlation pca), we tightly characterize the parameter regimes where deflation methods are feasible. moreover, we show that in all feasible regimes, $k$-cpca deflation algorithms suffer no asymptotic parameter loss for any constant $k$. we apply our framework to obtain state-of-the-art $k$-pca algorithms robust to dataset contamination, improving prior work both in sample complexity and approximation quality.",2024-03-06
"105","digitality as a ""longue durèe"" historical phenomenon","salvatore spina","computers and society","the digital age introduced the digital ecological niche (den), revolutionizing human interactions. the advent of digital history (dhy) has marked a methodological shift in historical studies, tracing its roots to babbage and lovelace's 19th-century work on ""coding"" as a foundational communication process, fostering a new interaction paradigm between humans and machines, termed ""person2persons2machines."" this evolution, through digitization and informatization, builds upon ancient coding practices but was significantly advanced by babbage and lovelace's contributions to mathematical linguistic systems, laying the groundwork for computer science. this field, central to 20th-century mainframe interaction through programming languages and formalization, situates digital history within a broader historical context. here, coding and mathematical methodologies empower historians with advanced technologies for historical data preservation and analysis. nonetheless, the extent to which computation and turing machines can fully understand and interpret history remains a subject of debate.",2024-03-06
"106","parameterized algorithms for balanced cluster edge modification problems","jayakrishnan madathil, kitty meeks","data structures and algorithms","we introduce cluster edge modification problems with constraints on the size of the clusters and study their complexity. a graph $g$ is a cluster graph if every connected component of $g$ is a clique. in a typical cluster edge modification problem such as the widely studied cluster editing, we are given a graph $g$ and a non-negative integer $k$ as input, and we have to decide if we can turn $g$ into a cluster graph by way of at most $k$ edge modifications -- that is, by adding or deleting edges. in this paper, we study the parameterized complexity of such problems, but with an additional constraint: the size difference between any two connected components of the resulting cluster graph should not exceed a given threshold. depending on which modifications are permissible -- only adding edges, only deleting edges, both adding and deleting edges -- we have three different computational problems. we show that all three problems, when parameterized by $k$, admit single-exponential time fpt algorithms and polynomial kernels. our problems may be thought of as the size-constrained or balanced counterparts of the typical cluster edge modification problems, similar to the well-studied size-constrained or balanced counterparts of other clustering problems such as $k$-means clustering.",2024-03-06
"107","in the search of optimal tree networks: hardness and heuristics","maxim buzdalov, pavel martynov, sergey pankratov, vitaly aksenov, stefan schmid","networking and internet architecture","demand-aware communication networks are networks whose topology is optimized toward the traffic they need to serve. these networks have recently been enabled by novel optical communication technologies and are investigated intensively in the context of datacenters. in this work, we consider networks with one of the most common topologies~ -- a binary tree. we show that finding an optimal demand-aware binary tree network is np-hard. then, we propose optimization algorithms that generate efficient binary tree networks on real-life and synthetic workloads.",2024-03-06
"108","largest common subgraph of two forests","dieter rautenbach, florian werner","data structures and algorithms","a common subgraph of two graphs $g_1$ and $g_2$ is a graph that is isomorphic to subgraphs of $g_1$ and $g_2$. in the largest common subgraph problem the task is to determine a common subgraph for two given graphs $g_1$ and $g_2$ that is of maximum possible size ${\rm lcs}(g_1,g_2)$. this natural problem generalizes the well-studied graph isomorphism problem, has many applications, and remains np-hard even restricted to unions of paths. we present a simple $4$-approximation algorithm for forests, and, for every fixed $\epsilon\in (0,1)$, we show that, for two given forests $f_1$ and $f_2$ of order at most $n$, one can determine in polynomial time a common subgraph $f$ of $f_1$ and $f_2$ with at least ${\rm lcs}(f_1,f_2)-\epsilon n$ edges. restricted to instances with ${\rm lcs}(f_1,f_2)\geq cn$ for some fixed positive $c$, this yields a polynomial time approximation scheme. our approach relies on the approximation of the given forests by structurally simpler forests that are composed of copies of only $o(\log (n))$ different starlike rooted trees and iterative quantizations of the options for the solutions.",2024-03-06
"109","wildest dreams: reproducible research in privacy-preserving neural network training","tanveer khan, mindaugas budzys, khoa nguyen, antonis michalas","cryptography and security","machine learning (ml), addresses a multitude of complex issues in multiple disciplines, including social sciences, finance, and medical research. ml models require substantial computing power and are only as powerful as the data utilized. due to high computational cost of ml methods, data scientists frequently use machine learning-as-a-service (mlaas) to outsource computation to external servers. however, when working with private information, like financial data or health records, outsourcing the computation might result in privacy issues. recent advances in privacy-preserving techniques (ppts) have enabled ml training and inference over protected data through the use of privacy-preserving machine learning (ppml). however, these techniques are still at a preliminary stage and their application in real-world situations is demanding. in order to comprehend discrepancy between theoretical research suggestions and actual applications, this work examines the past and present of ppml, focusing on homomorphic encryption (he) and secure multi-party computation (smpc) applied to ml. this work primarily focuses on the ml model's training phase, where maintaining user data privacy is of utmost importance. we provide a solid theoretical background that eases the understanding of current approaches and their limitations. in addition, we present a sok of the most recent ppml frameworks for model training and provide a comprehensive comparison in terms of the unique properties and performances on standard benchmarks. also, we reproduce the results for some of the papers and examine at what level existing works in the field provide support for open science. we believe our work serves as a valuable contribution by raising awareness about the current gap between theoretical advancements and real-world applications in ppml, specifically regarding open-source availability, reproducibility, and usability.",2024-03-06
"110","studying ecg signals using nonlinear oscillators and genetic algorithm","sourav chowdhury, apratim ghosal, suparna roychowhury, indranath chaudhuri","medical physics","cardiovascular diseases are the leading cause of death and disability in the world and thus their detection is extremely important as early as possible so that it can be prognosed and managed appropriately. hence, electrophysiological models dealing with cardiac conduction are critically important in the field of interdisciplinary sciences. the primary aim of this paper is to reproduce a normal sinus rhythm ecg waveform which will act as the baseline for fitting and then fit any clinical ecg waveform that does not deviate much from normal sinus rhythm. to reproduce the ecg, we modeled the pacemaker complex using three coupled van der pol (vdp) oscillators with appropriate delays to generate the action potentials. these action potentials are responsible for the excitation of the non-pacemaker cells of the atria and ventricles whose electrical activity gets recorded as the ecg signal. the ecg signal is composed of a periodic set of individual waves corresponding to atrial and ventricular contraction and relaxation. these waves are modeled with the help of four fitzhugh-nagumo (fhn) equations with impulses corresponding to the action potentials generated by the pacemaker cells. after the successful reproduction of a normal sinus rhythm ecg, we have developed a framework where we have used genetic algorithm (ga) to fit a given clinical ecg data with parameters belonging to the above mentioned system of delay differential equations (ddes). the ga framework has enabled us to fit ecg data representing different cardiac conditions reasonably well. we aim to use this work to get a better understanding of the cardiac conduction system and cardiovascular diseases which will help humanity in the future.",2024-03-06
"111","graph visualization for blockchain data","marcell dietl, andre gemünd, daniel oeltz, felix m. thiele, christian werner","data structures and algorithms","in this report, we introduce a novel approach to visualize extremely large graphs efficiently. our method combines two force-directed algorithms, kamada-kawai and forceatlas2, to handle different graph components based on their node count. additionally, we suggest utilizing the fast multipole method to enhance the speed of forceatlas2. although initially designed for analyzing bitcoin transaction graphs, for which we present results here, this algorithm can also be applied to other crypto currency transaction graphs or graphs from diverse domains.",2024-03-06
"112","double exponential lower bound for telephone broadcast","prafullkumar tale","data structures and algorithms","consider the telephone broadcast problem in which an input is a connected graph $g$ on $n$ vertices, a source vertex $s \in v(g)$, and a positive integer $t$. the objective is to decide whether there is a broadcast protocol from $s$ that ensures that all the vertices of $g$ get the message in at most $t$ rounds. we consider the broadcast protocol where, in a round, any node aware of the message can forward it to at most one of its neighbors. as the number of nodes aware of the message can at most double at each round, for a non-trivial instance we have $n \le 2^t$. hence, the brute force algorithm that checks all the permutations of the vertices runs in time $2^{2^{\calo(t)}} \cdot n^{\calo(1)}$. as our first result, we prove this simple algorithm is the best possible in the following sense. telephone broadcast does not admit an algorithm running in time $2^{2^{o(t)}} \cdot n^{\calo(1)}$, unless the ð fails. to the best of our knowledge, this is only the fourth example of \np-complete problem that admits a double exponential lower bound when parameterized by the solution size. it also resolves the question by fomin, fraigniaud, and golovach [wg 2023]. in the same article, the authors asked whether the problem is \fpt\ when parameterized by the feedback vertex set number of the graph. we answer this question in the negative. telephone broadcast, when restricted to graphs of the feedback vertex number one, and hence treewidth of two, is \np-\complete. we find this a relatively rare example of problems that admit a polynomial-time algorithm on trees but is \np-\complete\ on graphs of treewidth two.",2024-03-06
"113","undergraduate data science education: who has the microphone and what are they saying?","mine dogucu, sinem demirci, harry bendekgey, federica zoe ricci, catalina m. medina","other statistics","the presence of data science has been profound in the scientific community in almost every discipline. an important part of the data science education expansion has been at the undergraduate level. we conducted a systematic literature review to (1) specify current evidence and knowledge gaps in undergraduate data science education and (2) inform policymakers and data science educators/practitioners about the present status of data science education research. the majority of the publications in data science education that met our search criteria were available open-access. our results indicate that data science education research lacks empirical data and reproducibility. not all disciplines contribute equally to the field of data science education. computer science and data science as a separate field emerge as the leading contributors to the literature. in contrast, fields such as statistics, mathematics, as well as other fields closely related to data science exhibit a limited presence in studies. we recommend that federal agencies and researchers 1) invest in empirical data science education research; 2) diversify research efforts to enrich the spectrum of types of studies; 3) encourage scholars in key data science fields that are currently underrepresented in the literature to contribute more to research and publications.",2024-03-06
"114","fine-grained privacy guarantees for coverage problems","laxman dhulipala, george z. li","data structures and algorithms","we introduce a new notion of neighboring databases for coverage problems such as max cover and set cover under differential privacy. in contrast to the standard privacy notion for these problems, which is analogous to node-privacy in graphs, our new definition gives a more fine-grained privacy guarantee, which is analogous to edge-privacy. we illustrate several scenarios of set cover and max cover where our privacy notion is desired one for the application. our main result is an $\epsilon$-edge differentially private algorithm for max cover which obtains an $(1-1/e-\eta,\tilde{o}(k/\epsilon))$-approximation with high probability. furthermore, we show that this result is nearly tight: we give a lower bound show that an additive error of $\omega(k/\epsilon)$ is necessary under edge-differential privacy. via group privacy properties, this implies a new algorithm for $\epsilon$-node differentially private max cover which obtains an $(1-1/e-\eta,\tilde{o}(fk/\epsilon))$-approximation, where $f$ is the maximum degree of an element in the set system. when $f\ll k$, this improves over the best known algorithm for max cover under pure (node) differential privacy, which obtains an $(1-1/e,\tilde{o}(k^2/\epsilon))$-approximation.",2024-03-05
"115","deep configuration performance learning: a systematic survey and taxonomy","jingzhi gong, tao chen","software engineering","performance is arguably the most crucial attribute that reflects the behavior of a configurable software system. however, given the increasing scale and complexity of modern software, modeling and predicting how various configurations can impact performance becomes one of the major challenges in software maintenance. as such, performance is often modeled without having a thorough knowledge of the software system, but relying mainly on data, which fits precisely with the purpose of deep learning. in this paper, we conduct a comprehensive review exclusively on the topic of deep learning for performance learning of configurable software, covering 948 searched papers spanning six indexing services, based on which 85 primary papers were extracted and analyzed. our results summarize the key topics and statistics on how the configuration data is prepared; how the deep configuration performance learning model is built; how the model is evaluated and how they are exploited in different tasks related to software configuration. we also identify the good practice and the potentially problematic phenomena from the studies surveyed, together with insights on future opportunities for the field. to promote open science, all the raw results of this survey can be accessed at our repository: this https url.",2024-03-05
"116","maintaining light spanners via minimal updates","hadi khodabandeh, david eppstein","computational geometry","we study the problem of maintaining a lightweight bounded-degree $(1+\varepsilon)$-spanner of a dynamic point set in a $d$-dimensional euclidean space, where $\varepsilon>0$ and $d$ are arbitrary constants. in our fully-dynamic setting, points are allowed to be inserted as well as deleted, and our objective is to maintain a $(1+\varepsilon)$-spanner that has constant bounds on its maximum degree and its lightness (the ratio of its weight to that of the minimum spanning tree), while minimizing the recourse, which is the number of edges added or removed by each point insertion or deletion. we present a fully-dynamic algorithm that handles point insertion with amortized constant recourse and point deletion with amortized $o(\log\delta)$ recourse, where $\delta$ is the aspect ratio of the point set.",2024-03-05
