"","title","author","subject","abstract","date"
"35","learning-augmented algorithms with explicit predictors","marek elias, haim kaplan, yishay mansour, shay moran","machine learning","recent advances in algorithmic design show how to utilize predictions obtained by machine learning models from past and present data. these approaches have demonstrated an enhancement in performance when the predictions are accurate, while also ensuring robustness by providing worst-case guarantees when predictions fail. in this paper we focus on online problems; prior research in this context was focused on a paradigm where the predictor is pre-trained on past data and then used as a black box (to get the predictions it was trained for). in contrast, in this work, we unpack the predictor and integrate the learning problem it gives rise for within the algorithmic challenge. in particular we allow the predictor to learn as it receives larger parts of the input, with the ultimate goal of designing online learning algorithms specifically tailored for the algorithmic task at hand. adopting this perspective, we focus on a number of fundamental problems, including caching and scheduling, which have been well-studied in the black-box setting. for each of the problems we consider, we introduce new algorithms that take advantage of explicit learning algorithms which we carefully design towards optimizing the overall performance. we demonstrate the potential of our approach by deriving performance bounds which improve over those established in previous work.",2024-03-12
"36","satisfiability to coverage in presence of fairness, matroid, and global constraints","tanmay inamdar, pallavi jain, daniel lokshtanov, abhishek sahu, saket saurabh, anannya upasana","data structures and algorithms","in maxsat with cardinality constraint problem (cc-maxsat), we are given a cnf-formula $\phi$, and $k \ge 0$, and the goal is to find an assignment $\beta$ with at most $k$ variables set to true (also called a weight $k$-assignment) such that the number of clauses satisfied by $\beta$ is maximized. maxcov can be seen as a special case of cc-maxsat, where the formula $\phi$ is monotone, i.e., does not contain any negative literals. cc-maxsat and maxcov are extremely well-studied problems in the approximation algorithms as well as parameterized complexity literature. our first contribution is that the two problems are equivalent to each other in the context of fpt-approximation parameterized by $k$ (approximation is in terms of number of clauses satisfied/elements covered). we give a randomized reduction from cc-maxsat to maxcov in time $o(1/\epsilon)^{k} \cdot (m+n)^{o(1)}$ that preserves the approximation guarantee up to a factor of $1-\epsilon$. furthermore, this reduction also works in the presence of fairness and matroid constraints. armed with this reduction, we focus on designing fpt-approximation schemes (fpt-ases) for maxcov and its generalizations. our algorithms are based on a novel combination of a variety of ideas, including a carefully designed probability distribution that exploits sparse coverage functions. these algorithms substantially generalize the results in jain et al. [soda 2023] for cc-maxsat and maxcov for $k_{d,d}$-free set systems (i.e., no $d$ sets share $d$ elements), as well as a recent fpt-as for matroid-constrained maxcov by sellier [esa 2023] for frequency-$d$ set systems.",2024-03-12
"37","the primal pathwidth seth","michael lampis","computational complexity","motivated by the importance of dynamic programming (dp) in parameterized complexity, we consider several fine-grained questions, such as the following examples: (i) can dominating set be solved in time $(3-\epsilon)^{pw}n^{o(1)}$? (where $pw$ is the pathwidth) (ii) can coloring be solved in time $pw^{(1-\epsilon)pw}n^{o(1)}$? (iii) can a short reconfiguration between two size-$k$ independent sets be found in time $n^{(1-\epsilon)k}$? such questions are well-studied: in some cases the answer is no under the seth, while in others coarse-grained lower bounds are known under the eth. even though questions such as the above seem ""morally equivalent"" as they all ask if a simple dp can be improved, the problems concerned have wildly varying time complexities, ranging from single-exponential fpt to xnlp-complete. this paper's main contribution is to show that, despite their varying complexities, these questions are not just morally equivalent, but in fact they are the same question in disguise. we achieve this by putting forth a natural complexity assumption which we call the primal pathwidth-strong exponential time hypothesis (pp-seth) and which states that 3-sat cannot be solved in time $(2-\epsilon)^{pw}n^{o(1)}$, for any $\epsilon>0$, where $pw$ is the pathwidth of the primal graph of the input. we then show that numerous fine-grained questions in parameterized complexity, including the ones above, are equivalent to the pp-seth, and hence to each other. this allows us to obtain sharp fine-grained lower bounds for problems for which previous lower bounds left a constant in the exponent undetermined, but also to increase our confidence in bounds which were previously known under the seth, because we show that breaking any one such bound requires breaking all (old and new) bounds; and because we show that the pp-seth is more plausible than the seth.",2024-03-12
"38","noisy computing of the threshold function","ziao wang, nadim ghaddar, banghua zhu, lele wang","data structures and algorithms","let $\mathsf{th}_k$ denote the $k$-out-of-$n$ threshold function: given $n$ input boolean variables, the output is $1$ if and only if at least $k$ of the inputs are $1$. we consider the problem of computing the $\mathsf{th}_k$ function using noisy readings of the boolean variables, where each reading is incorrect with some fixed and known probability $p \in (0,1/2)$. as our main result, we show that, when $k = o(n)$, it is both sufficient and necessary to use $$(1 \pm o(1)) \frac{n\log \frac{k}{\delta}}{d_{\mathsf{kl}}(p || 1-p)}$$ queries in expectation to compute the $\mathsf{th}_k$ function with a vanishing error probability $\delta = o(1)$, where $d_{\mathsf{kl}}(p || 1-p)$ denotes the kullback-leibler divergence between $\mathsf{bern}(p)$ and $\mathsf{bern}(1-p)$ distributions. in particular, this says that $(1 \pm o(1)) \frac{n\log \frac{1}{\delta}}{d_{\mathsf{kl}}(p || 1-p)}$ queries in expectation are both sufficient and necessary to compute the $\mathsf{or}$ and $\mathsf{and}$ functions of $n$ boolean variables. compared to previous work, our result tightens the dependence on $p$ in both the upper and lower bounds.",2024-03-12
"39","improving deep learning with prior knowledge and cognitive models: a survey on enhancing explainability, adversarial robustness and zero-shot learning","fuseinin mumuni, alhassan mumuni","machine learning","we review current and emerging knowledge-informed and brain-inspired cognitive systems for realizing adversarial defenses, explainable artificial intelligence (xai), and zero-shot or few-short learning. data-driven deep learning models have achieved remarkable performance and demonstrated capabilities surpassing human experts in many applications. yet, their inability to exploit domain knowledge leads to serious performance limitations in practical applications. in particular, deep learning systems are exposed to adversarial attacks, which can trick them into making glaringly incorrect decisions. moreover, complex data-driven models typically lack interpretability or explainability, i.e., their decisions cannot be understood by human subjects. furthermore, models are usually trained on standard datasets with a closed-world assumption. hence, they struggle to generalize to unseen cases during inference in practical open-world environments, thus, raising the zero- or few-shot generalization problem. although many conventional solutions exist, explicit domain knowledge, brain-inspired neural network and cognitive architectures offer powerful new dimensions towards alleviating these problems. prior knowledge is represented in appropriate forms and incorporated in deep learning frameworks to improve performance. brain-inspired cognition methods use computational models that mimic the human mind to enhance intelligent behavior in artificial agents and autonomous robots. ultimately, these models achieve better explainability, higher adversarial robustness and data-efficient learning, and can, in turn, provide insights for cognitive science and neuroscience-that is, to deepen human understanding on how the brain works in general, and how it handles these problems.",2024-03-11
"40","imaging of i zw 18 by jwst: i. strategy and first results of dusty stellar populations","alec s. hirschauer, nicolas crouzet, nolan habel, laura lenkić, conor nally, olivia c. jones, giacomo bortolini, martha l. boyer, kay justtanont margaret meixner, göran östlin, gillian s. wright, ruyman azzollini, joris a. d. l. blommaert, bernhard brandl, leen decin, omnarayani nayak, pierre royer, b. a. sargent, paul van der werf","astrophysics of galaxies","we present a james webb space telescope (jwst) imaging survey of i zw 18, the archetypal extremely metal-poor, star-forming, blue compact dwarf galaxy. with an oxygen abundance of only $\sim$3% $z_{\odot}$, it is among the lowest-metallicity systems known in the local universe, and is, therefore, an excellent accessible analog for the galactic building blocks which existed at early epochs of ionization and star formation. these jwst data provide a comprehensive infrared (ir) view of i zw 18 with eight filters utilizing both nircam (f115w, f200w, f356w, and f444w) and miri (f770w, f1000w, f1500w, and f1800w) photometry, which we have used to identify key stellar populations that are bright in the near- and mid-ir. these data allow for a better understanding of the origins of dust and dust-production mechanisms in metal-poor environments by characterizing the population of massive, evolved stars in the red supergiant (rsg) and asymptotic giant branch (agb) phases. in addition, it enables the identification of the brightest dust-enshrouded young stellar objects (ysos), which provide insight into the formation of massive stars at extremely low metallicities typical of the very early universe. this paper provides an overview of the observational strategy and data processing, and presents first science results, including identifications of dusty agb star, rsg, and bright yso candidates. these first results assess the scientific quality of jwst data and provide a guide for obtaining and interpreting future observations of the dusty and evolved stars inhabiting compact dwarf star-forming galaxies in the local universe.",2024-03-11
"41","can llms separate instructions from data? and what do we even mean by that?","egor zverev, sahar abdelnabi, mario fritz, christoph h. lampert","machine learning","instruction-tuned large language models (llms) have achieved breakthrough results, opening countless new possibilities for many practical applications. however, llms lack elementary safety features that are established norms in other areas of computer science, such as the separation between instructions and data, causing them to malfunction or rendering them vulnerable to manipulation and interference by third parties e.g., via indirect prompt/command injection. even worse, so far, there is not even an established definition of what precisely such a separation would mean and how its violation could be tested. in this work, we aim to close this gap. we introduce a formal measure to quantify the phenomenon of instruction-data separation as well as an empirical variant of the measure that can be computed from a model`s black-box outputs. we also introduce a new dataset, sep (should it be executed or processed?), which allows estimating the measure, and we report results on several state-of-the-art open-source and closed llms. finally, we quantitatively demonstrate that all evaluated llms fail to achieve a high amount of separation, according to our measure. the source code and sep dataset are openly accessible at this https url.",2024-03-11
"42","smc-last extracted photometry","t. a. kuchar, g. c. sloan, d. r. mizuno, kathleen e. kraemer, m. l. boyer, martin a. t. groenewegen, o. c. jones, f. kemper, iain mcdonald, joana m. oliveira, marta sewiło, sundar srinivasan, jacco th. van loon, albert zijlstra","astrophysics of galaxies","we present point-source photometry from the spitzer space telescope's final survey of the small magellanic cloud (smc). we mapped 30 square degrees in two epochs in 2017, with the second extending to early 2018 at 3.6 and 4.5 microns using the infrared array camera. this survey duplicates the footprint from the sage-smc program in 2008. together, these surveys cover a nearly 10 yr temporal baseline in the smc. we performed aperture photometry on the mosaicked maps produced from the new data. we did not use any prior catalogs as inputs for the extractor in order to be sensitive to any moving objects (e.g., foreground brown dwarfs) and other transient phenomena (e.g., cataclysmic variables or fu ori-type eruptions). we produced a point-source catalog with high-confidence sources for each epoch as well as combined-epoch catalog. for each epoch and the combined-epoch data, we also produced a more complete archive with lower-confidence sources. all of these data products will be available to the community at the infrared science archive.",2024-03-11
"43","societal and scientific impact of policy research: a large-scale empirical study of some explanatory factors using altmetric and overton","pablo dorta-gonzález, alejandro rodríguez-caro, maría isabel dorta-gonzález","digital libraries","this study investigates how scientific research influences policymaking by analyzing citations of research articles in policy documents (policy impact) for nearly 125,000 articles across 434 public policy journals. we reveal distinct citation patterns between policymakers and other stakeholders like researchers, journalists, and the public. news and blog mentions, social media engagement, and open access publications (excluding fully open access) significantly increase the likelihood of a research article being cited in policy documents. conversely, articles locked behind paywalls and those published under the full open access model (based on altmetric data) have a lower chance of being policy-cited. publication year and policy type show no significant influence. our findings emphasize the crucial role of science communication channels like news media and social media in bridging the gap between research and policy. interestingly, academic citations hold a weaker influence on policy citations compared to news mentions, suggesting a potential disconnect between how researchers reference research and how policymakers utilize it. this highlights the need for improved communication strategies to ensure research informs policy decisions more effectively. this study provides valuable insights for researchers, policymakers, and science communicators. researchers can tailor their dissemination efforts to reach policymakers through media channels. policymakers can leverage these findings to identify research with higher policy relevance. science communicators can play a critical role in translating research for policymakers and fostering dialogue between the scientific and policymaking communities.",2024-03-11
"44","approximating maximum edge 2-coloring by normalizing graphs","tobias mömke, alexandru popa, aida roshany-tabrizi, michael ruderer, roland vincze","discrete mathematics","in a simple, undirected graph g, an edge 2-coloring is a coloring of the edges such that no vertex is incident to edges with more than 2 distinct colors. the problem maximum edge 2-coloring (me2c) is to find an edge 2-coloring in a graph g with the goal to maximize the number of colors. for a relevant graph class, me2c models anti-ramsey numbers and it was considered in network applications. for the problem a 2-approximation algorithm is known, and if the input graph has a perfect matching, the same algorithm has been shown to have a performance guarantee of 5/3. it is known that me2c is apx-hard and that it is ug-hard to obtain an approximation ratio better than 1.5. we show that if the input graph has a perfect matching, there is a polynomial time 1.625-approximation and if the graph is claw-free or if the maximum degree of the input graph is at most three (i.e., the graph is subcubic), there is a polynomial time 1.5-approximation algorithm for me2c",2024-03-11
"45","untangling gaussian mixtures","eva fluck, sandra kiefer, christoph standke","statistics theory","tangles were originally introduced as a concept to formalize regions of high connectivity in graphs. in recent years, they have also been discovered as a link between structural graph theory and data science: when interpreting similarity in data sets as connectivity between points, finding clusters in the data essentially amounts to finding tangles in the underlying graphs. this paper further explores the potential of tangles in data sets as a means for a formal study of clusters. real-world data often follow a normal distribution. accounting for this, we develop a quantitative theory of tangles in data sets drawn from gaussian mixtures. to this end, we equip the data with a graph structure that models similarity between the points and allows us to apply tangle theory to the data. we provide explicit conditions under which tangles associated with the marginal gaussian distributions exist asymptotically almost surely. this can be considered as a sufficient formal criterion for the separabability of clusters in the data.",2024-03-11
"46","optimal bounds for distinct quartics","panagiotis charalampopoulos, paweł gawrychowski, samah ghazawi","data structures and algorithms","a fundamental concept related to strings is that of repetitions. it has been extensively studied in many versions, from both purely combinatorial and algorithmic angles. one of the most basic questions is how many distinct squares, i.e., distinct strings of the form $uu$, a string of length $n$ can contain as fragments. it turns out that this is always $\mathcal{o}(n)$, and the bound cannot be improved to sublinear in $n$ [fraenkel and simpson, jcta 1998]. several similar questions about repetitions in strings have been considered, and by now we seem to have a good understanding of their repetitive structure. for higher-dimensional strings, the basic concept of periodicity has been successfully extended and applied to design efficient algorithms -- it is inherently more complex than for regular strings. extending the notion of repetitions and understanding the repetitive structure of higher-dimensional strings is however far from complete. quartics were introduced by apostolico and brimkov [tcs 2000] as analogues of squares in two dimensions. charalampopoulos, radoszewski, rytter, waleń, and zuba [esa 2020] proved that the number of distinct quartics in an $n\times n$ 2d string is $\mathcal{o}(n^2 \log^2 n)$ and that they can be computed in $\mathcal{o}(n^2 \log^2 n)$ time. gawrychowski, ghazawi, and landau [spire 2021] constructed an infinite family of $n \times n$ 2d strings with $\omega(n^2 \log n)$ distinct quartics. this brings the challenge of determining asymptotically tight bounds. here, we settle both the combinatorial and the algorithmic aspects of this question: the number of distinct quartics in an $n\times n$ 2d string is $\mathcal{o}(n^2 \log n)$ and they can be computed in the worst-case optimal $\mathcal{o}(n^2 \log n)$ time.",2024-03-11
"47","balanced substructures in bicolored graphs","p. s. ardra, r. krithika, saket saurabh, roohani sharma","data structures and algorithms","an edge-colored graph is said to be balanced if it has an equal number of edges of each color. given a graph $g$ whose edges are colored using two colors and a positive integer $k$, the objective in the edge balanced connected subgraph problem is to determine if $g$ has a balanced connected subgraph containing at least $k$ edges. we first show that this problem is np-complete and remains so even if the solution is required to be a tree or a path. then, we focus on the parameterized complexity of edge balanced connected subgraph and its variants (where the balanced subgraph is required to be a path/tree) with respect to $k$ as the parameter. towards this, we show that if a graph has a balanced connected subgraph/tree/path of size at least $k$, then it has one of size at least $k$ and at most $f(k)$ where $f$ is a linear function. we use this result combined with dynamic programming algorithms based on color coding and representative sets to show that edge balanced connected subgraph and its variants are fpt. further, using polynomial-time reductions to the multilinear monomial detection problem, we give faster randomized fpt algorithms for the problems. in order to describe these reductions, we define a combinatorial object called relaxed-subgraph. we define this object in such a way that balanced connected subgraphs, trees and paths are relaxed-subgraphs with certain properties. this object is defined in the spirit of branching walks known for the steiner tree problem and may be of independent interest.",2024-03-11
"48","arborescences and shortest path trees when colors matter","p. s. ardra, jasine babu, kritika kashyap, r. krithika, sreejith k. pallathumadam, deepak rajendraprasad","data structures and algorithms","color-constrained subgraph problems are those where we are given an edge-colored (directed or undirected) graph and the task is to find a specific type of subgraph, like a spanning tree, an arborescence, a single-source shortest path tree, a perfect matching etc., with constraints on the number of edges of each color. some of these problems, like color-constrained spanning tree, have elegant solutions and some of them, like color-constrained perfect matching, are longstanding open questions. in this work, we study color-constrained arborescences and shortest path trees. computing a color-constrained shortest path tree on weighted digraphs turns out to be np-hard in general but polynomial-time solvable when all cycles have positive weight. this polynomial-time solvability is due to the fact that the solution space is essentially the set of all color-constrained arborescences of a directed acyclic subgraph of the original graph. while finding color-constrained arborescence of digraphs is np-hard in general, we give efficient algorithms when the input graph is acyclic. consequently, a color-constrained shortest path tree on weighted digraphs having only positive weight cycles can be efficiently computed. our algorithms also generalize to the problem of finding a color-constrained shortest path tree with minimum total weight. en route, we sight nice connections to colored matroids and color-constrained bases.",2024-03-11
"49","an algorithm for correct computation of reeb spaces for pl bivariate fields","amit chattopadhyay, yashwanth ramamurthi, osamu saeki","computational geometry","the reeb space is a topological structure which is a generalization of the notion of the reeb graph to multi-fields. its effectiveness has been established in revealing topological features in data across diverse computational domains which cannot be identified using the reeb graph or other scalar-topology-based methods. approximations of reeb spaces such as the mapper and the joint contour net have been developed based on quantization of the range. however, computing the topologically correct reeb space dispensing the range-quantization is a challenging problem. in the current paper, we develop an algorithm for computing a correct net-like approximation corresponding to the reeb space of a generic piecewise-linear (pl) bivariate field based on a multi-dimensional reeb graph (mdrg). first, we prove that the reeb space is homeomorphic to its mdrg. subsequently, we introduce an algorithm for computing the mdrg of a generic pl bivariate field through the computation of its jacobi set and jacobi structure, a projection of the jacobi set into the reeb space. this marks the first algorithm for mdrg computation without requiring the quantization of bivariate fields. following this, we compute a net-like structure embedded in the corresponding reeb space using the mdrg and the jacobi structure. we provide the proof of correctness and complexity analysis of our algorithm.",2024-03-11
"50","fun maximizing search, (non) instance optimality, and video games for parrots","jérémy barbay","data structures and algorithms","computerized adaptive testing (cat) measures an examinee's ability while adapting to their level. both too many questions and too many hard questions can make a test frustrating. are there some cat algorithms which can be proven to be theoretically better than others, and in which framework? we show that slightly extending the traditional framework yields a partial order on cat algorithms. for uni-dimensional knowledge domains, we analyze the theoretical performance of some old and new algorithms, and we prove that none of the algorithms presented are instance optimal, conjecturing that no instance optimal can exist for the cat problem.",2024-03-11
