"","title","author","subject","abstract","date"
"66","an intelligent assistive system based on augmented reality and internet of things for patients with alzheimer's disease","fatemeh ghorbani","human-computer interaction","independent life of the individuals suffering from alzheimer's disease (ad) is compromised due to their memory loss. as a result, they depend on others to help them lead their daily life. in this situation, either the family members or the caregivers offer their help; they attach notes on every single object or take out the contents of a drawer to make those visible when they leave the patient alone. the aim of this thesis is to provide multi-level support and some helping means for ad patients and their family members through the integration of existing science and methods. this study reports results on an intelligent assistive (ia) system, achieved through the integration of internet of things (iot), augmented reality (ar), and adaptive fuzzy decision-making methods. the proposed system has four main components; (1) a location and heading data stored in the local fog layer, (2) an ar device to make interactions with the ad patient, (3) a supervisory decision-maker to handle the direct and environmental interactions with the patient, (4) and a user interface for family or caregivers to monitor the patient's real-time situation and send reminders once required. the system operates in different modes, including automated and semi-automated. the first one helps the user complete the activities in their daily life by showing ar messages or making automatic changes. the second one allows manual changes after the real-time assessment of the user's cognitive state based on the ar game score. we provide further evidence that the accuracy, reliability and response time of the ia system are appropriate to be implemented in ad patients' homes. moreover, the system response in the semi-automated mode causes less data loss than the automated mode, as the number of active devices decreases.",2024-02-21
"67","understanding the progression of educational topics via semantic matching","tamador alkhidir (1), edmond awad (2), aamena alshamsi (3) ((1) curriculum department, ministry of education, united arab emirates, (2) department of economics and institute for data science and ai, university of exeter, united kingdom,(3) heuristic world, dubai, united arab emirates)","computers and society","education systems are dynamically changing to accommodate technological advances, industrial and societal needs, and to enhance students' learning journeys. curriculum specialists and educators constantly revise taught subjects across educational grades to identify gaps, introduce new learning topics, and enhance the learning outcomes. this process is usually done within the same subjects (e.g. math) or across related subjects (e.g. math and physics) considering the same and different educational levels, leading to massive multi-layer comparisons. having nuanced data about subjects, topics, and learning outcomes structured within a dataset, empowers us to leverage data science to better understand the progression of various learning topics. in this paper, bidirectional encoder representations from transformers (bert) topic modeling was used to extract topics from the curriculum, which were then used to identify relationships between subjects, track their progression, and identify conceptual gaps. we found that grouping learning outcomes by common topics helped specialists reduce redundancy and introduce new concepts in the curriculum. we built a dashboard to avail the methodology to curriculum specials. finally, we tested the validity of the approach with subject matter experts.",2024-02-10
"68","nurses as agents for achieving environmentally sustainable health systems: a bibliometric analysis","olga maria luque alcaraz, pilar aparicio-martínez, antonio gomera, manuel vaquero-abellán","computers and society","objective: to analyze the current scientific knowledge and research lines focused on environmentally sustainable health systems, including the role of nurses. background: there seem to be differences between creating interventions focused on environmentally sustainable health systems, including nurses, and the scarcity of research on this topic, framed on the sustainable development goals. methods: a bibliometric analysis was carried out, via three databases (web of science, scopus, and pubmed), and the guideline recommendations were followed to select bibliometric data. results: the search resulted in 159 publications, significantly increasing the trends from 2017 to 2021 (p=0.028). the most relevant countries in this area were the united states of america, the united kingdom, and sweden. also, the top articles were from relevant journals, indexed in journal citation report, and the first and the second quartile linked to the nursing field and citations (p<0.001). conclusion: education is key to achieving environmentally sustainable health systems via institutions and policies. implications for nursing management: there is a lack of experimental data and policies on achieving or maintaining environmentally sustainable health care systems, indicating that nurses have an important role and should be consulted and included in decision-making policies regarding sustainability in the healthcare systems.",2024-02-05
"69","the nirspec wide gto survey","michael v. maseda, anna de graaff, marijn franx, hans-walter rix, stefano carniani, isaac laseter, ugne dudzeviciute, tim rawle, eleonora parlanti, santiago arribas, andrew j. bunker, alex j. cameron, stephane charlot, mirko curti, francesco d'eugenio, gareth c. jones, nimisha kumari, roberto maiolino, hannah uebler, aayush saxena, renske smit, chris willott, joris witstok","astrophysics of galaxies","the near-infrared spectrograph (nirspec) on the james webb space telescope is uniquely suited to studying galaxies in the distant universe with its combination of multi-object capabilities and sensitivity over a large range in wavelength (0.6-5.3 microns). here we present the nirspec wide survey, part of the nirspec instrument science team's guaranteed time observations, using nirspec's microshutter array to obtain spectra of more than 3200 galaxies at $z>1$ at both low- and high-resolution ($r\approx100$ and 2700) for a total of 105 hours. with 31 pointings covering $\approx$320 arcmin$^2$ across the five candels fields with exquisite ancillary photometry from the hubble space telescope, the nirspec wide survey represents a fast and efficient way of using jwst to probe galaxies in the early universe. pointing centers are determined to maximize the observability of the rarest, high-value sources. subsequently, the microshutter configurations are optimized to observe the maximum number of ""census"" galaxies with a selection function based primarily on hst/f160w magnitude, photometric/slitless grism redshift, and predicted \ha\ flux tracing the bulk of the galaxy population at cosmic noon ($z_{\rm med}=2.0$). we present details on the survey strategy, the target selection, an outline of the motivating science cases, and discuss upcoming public data releases to the community.",2024-03-08
"70","sparse dynamic network reconstruction through l1-regularization of a lyapunov equation","ian xul belaustegui, marcela ordorica arango, román rossi-pool, naomi ehrich leonard, alessio franci","systems and control","an important problem in many areas of science is that of recovering interaction networks from simultaneous time-series of many interacting dynamical processes. a common approach is to use the elements of the correlation matrix or its inverse as proxies of the interaction strengths, but the reconstructed networks are necessarily undirected. transfer entropy methods have been proposed to reconstruct directed networks but the reconstructed network lacks information about interaction strengths. we propose a network reconstruction method that inherits the best of the two approaches by reconstructing a directed weighted network from noisy data under the assumption that the network is sparse and the dynamics are governed by a linear (or weakly-nonlinear) stochastic dynamical system. the two steps of our method are i) constructing an (infinite) family of candidate networks by solving the covariance matrix lyapunov equation for the state matrix and ii) using l1-regularization to select a sparse solution. we further show how to use prior information on the (non)existence of a few directed edges to drastically improve the quality of the reconstruction.",2024-03-08
"71","advances of deep learning in protein science: a comprehensive survey","bozhen hu, cheng tan, lirong wu, jiangbin zheng, jun xia, zhangyang gao, zicheng liu, fandi wu, guijun zhang, stan z. li","biomolecules","protein representation learning plays a crucial role in understanding the structure and function of proteins, which are essential biomolecules involved in various biological processes. in recent years, deep learning has emerged as a powerful tool for protein modeling due to its ability to learn complex patterns and representations from large-scale protein data. this comprehensive survey aims to provide an overview of the recent advances in deep learning techniques applied to protein science. the survey begins by introducing the developments of deep learning based protein models and emphasizes the importance of protein representation learning in drug discovery, protein engineering, and function annotation. it then delves into the fundamentals of deep learning, including convolutional neural networks, recurrent neural networks, attention models, and graph neural networks in modeling protein sequences, structures, and functions, and explores how these techniques can be used to extract meaningful features and capture intricate relationships within protein data. next, the survey presents various applications of deep learning in the field of proteins, including protein structure prediction, protein-protein interaction prediction, protein function prediction, etc. furthermore, it highlights the challenges and limitations of these deep learning techniques and also discusses potential solutions and future directions for overcoming these challenges. this comprehensive survey provides a valuable resource for researchers and practitioners in the field of proteins who are interested in harnessing the power of deep learning techniques. by consolidating the latest advancements and discussing potential avenues for improvement, this review contributes to the ongoing progress in protein research and paves the way for future breakthroughs in the field.",2024-03-08
"72","interoperability of the metaverse: a digital ecosystem perspective review","liang yang, shi-ting ni, yuyang wang, ao yu, jyh-an lee, pan hui","computers and society","the metaverse is at the vanguard of the impending digital revolution, with the potential to significantly transform industries and lifestyles. however, in 2023, skepticism surfaced within industrial and academic spheres, raising concerns that excitement may outpace actual technological progress. interoperability, recognized as a major barrier to the metaverse's full potential, is central to this debate. coinmarketcap's report in february 2023 indicated that of over 240 metaverse initiatives, most existed in isolation, underscoring the interoperability challenge. despite consensus on its critical role, there is a research gap in exploring the impact on the metaverse, significance, and developmental extent. our study bridges this gap via a systematic literature review and content analysis of the web of science (wos) and scopus databases, yielding 74 publications after a rigorous selection process. interoperability, difficult to define due to varied contexts and lack of standardization, is central to the metaverse, often seen as a digital ecosystem. urs gasser's framework from harvard law school, outlining technological, data, human, and institutional dimensions, systematically addresses interoperability complexities. incorporating this framework, we dissect literature for a comprehensive metaverse interoperability overview. our study seeks to establish benchmarks for future inquiries, navigating the complex field of metaverse interoperability studies and contributing to academic advancement.",2024-03-08
"73","efficient algorithms for personalized pagerank computation: a survey","mingji yang, hanzhi wang, zhewei wei, sibo wang, ji-rong wen","data structures and algorithms","personalized pagerank (ppr) is a traditional measure for node proximity on large graphs. for a pair of nodes $s$ and $t$, the ppr value $\pi_s(t)$ equals the probability that an $\alpha$-discounted random walk from $s$ terminates at $t$ and reflects the importance between $s$ and $t$ in a bidirectional way. as a generalization of google's celebrated pagerank centrality, ppr has been extensively studied and has found multifaceted applications in many fields, such as network analysis, graph mining, and graph machine learning. despite numerous studies devoted to ppr over the decades, efficient computation of ppr remains a challenging problem, and there is a dearth of systematic summaries and comparisons of existing algorithms. in this paper, we recap several frequently used techniques for ppr computation and conduct a comprehensive survey of various recent ppr algorithms from an algorithmic perspective. we classify these approaches based on the types of queries they address and review their methodologies and contributions. we also discuss some representative algorithms for computing ppr on dynamic graphs and in parallel or distributed environments.",2024-03-08
"74","putting language into context using smartphone-based keyboard logging","florian bemmann, timo koch, maximilian bergmann, clemens stachl, daniel buschek, ramona schoedel, sven mayer","human-computer interaction","while the study of language as typed on smartphones offers valuable insights, existing data collection methods often fall short in providing contextual information and ensuring user privacy. we present a privacy-respectful approach - context-enriched keyboard logging - that allows for the extraction of contextual information on the user's input motive, which is meaningful for linguistics, psychology, and behavioral sciences. in particular, with our approach, we enable distinguishing language contents by their channel (i.e., comments, messaging, search inputs). filtering by channel allows for better pre-selection of data, which is in the interest of researchers and improves users' privacy. we demonstrate our approach on a large-scale six-month user study (n=624) of language use in smartphone interactions in the wild. finally, we highlight the implications for research on language use in human-computer interaction and interdisciplinary contexts.",2024-03-08
"75","inverse design of photonic crystal surface emitting lasers is a sequence modeling problem","ceyao zhang, renjie li, cheng zhang, zhaoyu zhang, feng yin","applied physics","photonic crystal surface emitting lasers (pcsel)'s inverse design demands expert knowledge in physics, materials science, and quantum mechanics which is prohibitively labor-intensive. advanced ai technologies, especially reinforcement learning (rl), have emerged as a powerful tool to augment and accelerate this inverse design process. by modeling the inverse design of pcsel as a sequential decision-making problem, rl approaches can construct a satisfactory pcsel structure from scratch. however, the data inefficiency resulting from online interactions with precise and expensive simulation environments impedes the broader applicability of rl approaches. recently, sequential models, especially the transformer architecture, have exhibited compelling performance in sequential decision-making problems due to their simplicity and scalability to large language models. in this paper, we introduce a novel framework named pcsel inverse design transformer (pit) that abstracts the inverse design of pcsel as a sequence modeling problem. the central part of our pit is a transformer-based structure that leverages the past trajectories and current states to predict the current actions. compared with the traditional rl approaches, pit can output the optimal actions and achieve target pcsel designs by leveraging offline data and conditioning on the desired return. results demonstrate that pit achieves superior performance and data efficiency compared to baselines.",2024-03-08
"76","improving the open cluster census. iii. using cluster masses, radii, and dynamics to create a cleaned open cluster catalogue","emily l. hunt, sabine reffert","astrophysics of galaxies","the census of open clusters has exploded in size thanks to data from the gaia satellite. however, it is likely that many of these reported clusters are not gravitationally bound, making the open cluster census impractical for many scientific applications. we test different physically motivated methods for distinguishing between bound and unbound clusters, using them to create a cleaned cluster catalogue. we derived completeness-corrected photometric masses for 6956 clusters from our earlier work. then, we used these masses to compute the size of the roche surface of these clusters (their jacobi radius) and distinguish between bound and unbound clusters. we find that only 5647 (79%) of the clusters from our previous catalogue are compatible with bound open clusters, dropping to just 11% of clusters within 250 pc. 3530 open clusters are in a strongly cut high quality sample. the moving groups in our sample show different trends in their size as a function of age and mass, suggesting that they are unbound and undergoing different dynamical processes. our cluster mass measurements constitute the largest catalogue of milky way cluster masses to date, which we also use for further science. firstly, we inferred the mass-dependent completeness limit of the open cluster census, showing that the census is complete within 1.8 kpc only for objects heavier than 230 m$_\odot$. next, we derived a completeness-corrected age and mass function for our open cluster catalogue, including estimating that the milky way contains a total of $1.3 \times 10^5$ open clusters, only ~4% of which are currently known. finally, we show that most open clusters have mass functions compatible with the kroupa initial mass function. we demonstrate jacobi radii for distinguishing between bound and unbound star clusters, and publish an updated star cluster catalogue with masses and improved cluster classifications. (abridged)",2024-03-08
"77","single family algebra operation on zdds leads to exponential blow-up","kengo nakamura, masaaki nishino, shuhei denzumi","data structures and algorithms","zero-suppressed binary decision diagram (zdd) is a data structure to represent a family of (sub)sets compactly, and it can be used as a succinct index for a family of sets. to build zdd representing a desired family of sets, there are many transformation operations that take zdds as inputs and output zdd representing the resultant family after performing operations such as set union and intersection. however, except for some basic operations, the worst-time complexity of taking such transformation on zdds has not been extensively studied, and some contradictory statements about it have arisen in the literature. in this paper, we show that many transformation operations on zdds cannot be performed in worst-case polynomial time with respect to the size of input zdds. this refutes some of the folklore circulated in past literature and resolves an open problem raised by knuth. our results are stronger in that such blow-up of computational time occurs even when the ordering, which has a significant impact on the efficiency of treating zdds, is reasonable.",2024-03-08
"78","data-dependent lsh for the earth mover's distance","rajesh jayaram, erik waingarten, tian zhang","data structures and algorithms","we give new data-dependent locality sensitive hashing schemes (lsh) for the earth mover's distance ($\mathsf{emd}$), and as a result, improve the best approximation for nearest neighbor search under $\mathsf{emd}$ by a quadratic factor. here, the metric $\mathsf{emd}_s(\mathbb{r}^d,\ell_p)$ consists of sets of $s$ vectors in $\mathbb{r}^d$, and for any two sets $x,y$ of $s$ vectors the distance $\mathsf{emd}(x,y)$ is the minimum cost of a perfect matching between $x,y$, where the cost of matching two vectors is their $\ell_p$ distance. previously, andoni, indyk, and krauthgamer gave a (data-independent) locality-sensitive hashing scheme for $\mathsf{emd}_s(\mathbb{r}^d,\ell_p)$ when $p \in [1,2]$ with approximation $o(\log^2 s)$. by being data-dependent, we improve the approximation to $\tilde{o}(\log s)$. our main technical contribution is to show that for any distribution $\mu$ supported on the metric $\mathsf{emd}_s(\mathbb{r}^d, \ell_p)$, there exists a data-dependent lsh for dense regions of $\mu$ which achieves approximation $\tilde{o}(\log s)$, and that the data-independent lsh actually achieves a $\tilde{o}(\log s)$-approximation outside of those dense regions. finally, we show how to ""glue"" together these two hashing schemes without any additional loss in the approximation. beyond nearest neighbor search, our data-dependent lsh also gives optimal (distributional) sketches for the earth mover's distance. by known sketching lower bounds, this implies that our lsh is optimal (up to $\mathrm{poly}(\log \log s)$ factors) among those that collide close points with constant probability.",2024-03-08
"79","a basic lower bound for property testing","eldar fischer","data structures and algorithms","an $\epsilon$-test for any non-trivial property (one for which there are both satisfying inputs and inputs of large distance from the property) should use a number of queries that is at least inversely proportional in $\epsilon$. however, to the best of our knowledge there is no reference proof for this intuition. such a proof is provided here. it is written so as to not require any prior knowledge of the related literature, and in particular does not use yao's method.",2024-03-08
"80","np-completeness for the space-optimality of double-array tries","hideo bannai, keisuke goto, shunsuke kanda, dominik köppl","data structures and algorithms","indexing a set of strings for prefix search or membership queries is a fundamental task with many applications such as information retrieval or database systems. a classic abstract data type for modelling such an index is a trie. due to the fundamental nature of this problem, it has sparked much interest, leading to a variety of trie implementations with different characteristics. a trie implementation that has been well-used in practice is the double-array (trie) consisting of merely two integer arrays. while a traversal takes constant time per node visit, the needed space consumption in computer words can be as large as the product of the number of nodes and the alphabet size. despite that several heuristics have been proposed on lowering the space requirements, we are unaware of any theoretical guarantees. in this paper, we study the decision problem whether there exists a double-array of a given size. to this end, we first draw a connection to the sparse matrix compression problem, which makes our problem np-complete for alphabet sizes linear to the number of nodes. we further propose a reduction from the restricted directed hamiltonian path problem, leading to np-completeness even for logarithmic-sized alphabets.",2024-03-07
"81","a mixed-integer conic program for the moving-target traveling salesman problem based on a graph of convex sets","allen george philip, zhongqiang ren, sivakumar rathinam, howie choset","robotics","this paper introduces a new formulation that finds the optimum for the moving-target traveling salesman problem (mt-tsp), which seeks to find a shortest path for an agent, that starts at a depot, visits a set of moving targets exactly once within their assigned time-windows, and returns to the depot. the formulation relies on the key idea that when the targets move along lines, their trajectories become convex sets within the space-time coordinate system. the problem then reduces to finding the shortest path within a graph of convex sets, subject to some speed constraints. we compare our formulation with the current state-of-the-art mixed integer conic program (micp) solver for the mt-tsp. the experimental results show that our formulation outperforms the micp for instances with up to 20 targets, with up to two orders of magnitude reduction in runtime, and up to a 60\% tighter optimality gap. we also show that the solution cost from the convex relaxation of our formulation provides significantly tighter lower bounds for the mt-tsp than the ones from the micp.",2024-03-07
